{
  "contract_version": "1.0",
  "id_operacion": "123e4567-e89b-42d3-a456-426614174103",
  "tipo": "ASIGNACION",
  "persona_uuid": "123e4567-e89b-42d3-a456-426614174200",
  "uid_rfid": "A1B2C3D4",
  "motivo": null,
  "expected_persona_version": 3,
  "ocurrido_en": "2026-08-30 16:03:00",
  "usuario": { "id": "42", "nombre": "AUXILIAR TIC", "rol": "CARNETIZACION" }
}
